[
  {"id":"openai","name":"OpenAI","name_cn":"OpenAI","logo":"O","country":"US","website":"https://openai.com/","api_docs":"https://platform.openai.com/docs","api_base_url":"https://api.openai.com/v1","api_style":"openai","description_cn":"综合能力、生态和 Agent 能力覆盖广。","open_weight":false,"source":"official","last_verified":"2026-08-05","brand_color":"#10A37F","logo_file":"assets/logos/openai.svg"},
  {"id":"anthropic","name":"Anthropic","name_cn":"Anthropic","logo":"A","country":"US","website":"https://www.anthropic.com/","api_docs":"https://docs.anthropic.com/","api_base_url":"https://api.anthropic.com","api_style":"anthropic","description_cn":"专注安全、长文本、代码和企业应用。","open_weight":false,"source":"official","last_verified":"2026-08-05","brand_color":"#D97757","logo_file":"assets/logos/anthropic.svg"},
  {"id":"google","name":"Google Gemini","name_cn":"Google Gemini","logo":"G","country":"US","website":"https://ai.google.dev/","api_docs":"https://ai.google.dev/gemini-api/docs","api_base_url":"https://generativelanguage.googleapis.com/v1beta","api_style":"google","description_cn":"多模态和长上下文模型生态。","open_weight":false,"source":"official","last_verified":"2026-08-05","brand_color":"#4285F4","logo_file":"assets/logos/google.svg"},
  {"id":"deepseek","name":"DeepSeek","name_cn":"DeepSeek","logo":"D","country":"CN","website":"https://www.deepseek.com/","api_docs":"https://api-docs.deepseek.com/","api_base_url":"https://api.deepseek.com","api_style":"openai","description_cn":"中文推理、代码和高性价比 API，模型 MIT 开放权重。","open_weight":true,"source":"official","last_verified":"2026-08-05","brand_color":"#4D6BFE","logo_file":"assets/logos/deepseek.svg"},
  {"id":"alibaba-qwen","name":"Qwen","name_cn":"阿里通义千问","logo":"Q","country":"CN","website":"https://qwenlm.github.io/","api_docs":"https://help.aliyun.com/zh/model-studio/","api_base_url":"https://dashscope.aliyuncs.com/compatible-mode/v1","api_style":"openai","description_cn":"覆盖中文、推理、代码和开放权重生态。","open_weight":true,"source":"official","last_verified":"2026-08-05","brand_color":"#6336E7","logo_file":"assets/logos/alibaba-qwen.svg"},
  {"id":"zhipu-glm","name":"Zhipu GLM","name_cn":"智谱 GLM","logo":"Z","country":"CN","website":"https://www.zhipuai.cn/","api_docs":"https://open.bigmodel.cn/dev/api","api_base_url":"https://open.bigmodel.cn/api/paas/v4","api_style":"openai","description_cn":"面向中文 Agent 和企业应用，GLM-5 开源。","open_weight":true,"source":"official","last_verified":"2026-08-05","brand_color":"#3859FF","logo_file":"assets/logos/zhipu-glm.svg"},
  {"id":"moonshot-kimi","name":"Moonshot Kimi","name_cn":"月之暗面 Kimi","logo":"K","country":"CN","website":"https://www.moonshot.cn/","api_docs":"https://platform.moonshot.cn/docs","api_base_url":"https://api.moonshot.cn/v1","api_style":"openai","description_cn":"中文长文本阅读和代码工作流。","open_weight":false,"source":"official","last_verified":"2026-08-05","brand_color":"#1783FF","logo_file":"assets/logos/moonshot-kimi.svg"},
  {"id":"baidu","name":"Baidu ERNIE","name_cn":"百度文心","logo":"B","country":"CN","website":"https://cloud.baidu.com/","api_docs":"https://cloud.baidu.com/doc/WENXINWORKSHOP/","api_base_url":"https://qianfan.baidubce.com/v2","api_style":"openai","description_cn":"中文企业应用和百度智能云生态，ERNIE 4.5 开放权重。","open_weight":true,"source":"official","last_verified":"2026-08-05","brand_color":"#0A51C3","logo_file":"assets/logos/baidu.svg"},
  {"id":"minimax","name":"MiniMax","name_cn":"MiniMax","logo":"M","country":"CN","website":"https://www.minimaxi.com/","api_docs":"https://platform.minimaxi.com/document/","api_base_url":"https://api.minimax.io/v1","api_style":"openai","description_cn":"文本、语音和多模态模型生态。","open_weight":false,"source":"official","last_verified":"2026-08-05","brand_color":"#E2167E","logo_file":"assets/logos/minimax.svg"},
  {"id":"mistral","name":"Mistral AI","name_cn":"Mistral AI","logo":"m","country":"FR","website":"https://mistral.ai/","api_docs":"https://docs.mistral.ai/","api_base_url":"https://api.mistral.ai/v1","api_style":"openai","description_cn":"欧洲模型厂商，提供 API 和开放权重模型。","open_weight":true,"source":"official","last_verified":"2026-08-05","brand_color":"#FA500F","logo_file":"assets/logos/mistral.svg"},
  {"id":"xai","name":"xAI","name_cn":"xAI","logo":"x","country":"US","website":"https://x.ai/","api_docs":"https://docs.x.ai/","api_base_url":"https://api.x.ai/v1","api_style":"openai","description_cn":"Grok 系列通用和推理模型，实时 X 检索。","open_weight":false,"source":"official","last_verified":"2026-08-05","brand_color":"#1A1A1A","logo_file":"assets/logos/xai.svg"},
  {"id":"meta","name":"Meta Llama","name_cn":"Meta Llama","logo":"L","country":"US","website":"https://llama.meta.com/","api_docs":"https://www.llama.com/docs/","api_base_url":null,"api_style":"openai","description_cn":"开放权重模型，适合本地和私有化部署。","open_weight":true,"source":"official","last_verified":"2026-08-05","brand_color":"#0082FB","logo_file":"assets/logos/meta.svg"},
  {"id":"kuaishou","name":"Kuaishou AI","name_cn":"快手可灵","logo":"可","country":"CN","website":"https://klingai.com/","api_docs":"https://klingai.com/dev","api_base_url":"https://api.klingai.com","api_style":"media","description_cn":"可灵视频生成，4K@60fps，免费额度充足。","open_weight":false,"source":"official","last_verified":"2026-08-05","brand_color":"#FF5000","logo_file":"assets/logos/kuaishou.svg"},
  {"id":"runway","name":"Runway","name_cn":"Runway","logo":"R","country":"US","website":"https://runwayml.com/","api_docs":"https://docs.dev.runwayml.com/","api_base_url":"https://api.dev.runwayml.com/v1","api_style":"media","description_cn":"创意视频生成与控制，Motion Brush 导演模式。","open_weight":false,"source":"official","last_verified":"2026-08-05","brand_color":"#1A1A1A","logo_file":"assets/logos/runway.svg"},
  {"id":"bytedance","name":"ByteDance Seedance","name_cn":"字节 Seedance","logo":"字","country":"CN","website":"https://seedance.ai/","api_docs":"https://www.volcengine.com/docs","api_base_url":"https://ark.cn-beijing.volcesecdn.com/api/v3","api_style":"media","description_cn":"高速多镜头视频生成，原生同步音频。","open_weight":false,"source":"official","last_verified":"2026-08-05","brand_color":"#3C8CFF","logo_file":"assets/logos/bytedance.svg"},
  {"id":"luma","name":"Luma AI","name_cn":"Luma AI","logo":"卢","country":"US","website":"https://lumalabs.ai/","api_docs":"https://docs.lumalabs.ai/","api_base_url":"https://api.lumalabs.ai","api_style":"media","description_cn":"物理运动真实的视频生成（Ray 系列）。","open_weight":false,"source":"official","last_verified":"2026-08-05","brand_color":"#004EFF","logo_file":"assets/logos/luma.svg"},
  {"id":"midjourney","name":"Midjourney","name_cn":"Midjourney","logo":"梦","country":"US","website":"https://www.midjourney.com/","api_docs":null,"api_base_url":null,"api_style":"media","description_cn":"艺术质量标杆图像生成，无公开 API。","open_weight":false,"source":"official","last_verified":"2026-08-05","brand_color":"#1A1A1A","logo_file":"assets/logos/midjourney.svg"},
  {"id":"blackforest","name":"Black Forest Labs","name_cn":"Black Forest Labs","logo":"F","country":"DE","website":"https://blackforestlabs.ai/","api_docs":"https://fal.ai/models","api_base_url":"https://api.bfl.ml/v1","api_style":"media","description_cn":"Flux 开放权重图像生成，照片级真实。","open_weight":true,"source":"official","last_verified":"2026-08-05","brand_color":"#1A1A1A","logo_file":"assets/logos/blackforest.svg"},
  {"id":"stability","name":"Stability AI","name_cn":"Stability AI","logo":"S","country":"GB","website":"https://stability.ai/","api_docs":"https://platform.stability.ai/","api_base_url":"https://api.stability.ai/v1","api_style":"media","description_cn":"Stable Diffusion 开源图像生成生态。","open_weight":true,"source":"official","last_verified":"2026-08-05","brand_color":"#9D39FF","logo_file":"assets/logos/stability.svg"},
  {"id":"adobe","name":"Adobe Firefly","name_cn":"Adobe Firefly","logo":"创","country":"US","website":"https://www.adobe.com/products/firefly.html","api_docs":"https://developers.adobe.com/firefly/","api_base_url":"https://api.adobe.com","api_style":"media","description_cn":"商业安全图像生成，与 Creative Cloud 集成。","open_weight":false,"source":"official","last_verified":"2026-08-05","brand_color":"#EB1000","logo_file":"assets/logos/adobe.svg"},
  {"id":"ideogram","name":"Ideogram","name_cn":"Ideogram","logo":"I","country":"US","website":"https://ideogram.ai/","api_docs":"https://developer.ideogram.ai/","api_base_url":"https://api.ideogram.ai","api_style":"media","description_cn":"图像内文字排版渲染最佳。","open_weight":false,"source":"official","last_verified":"2026-08-05","brand_color":"#1A1A1A","logo_file":"assets/logos/ideogram.svg"},
  {"id":"agnes","name":"Agnes AI","name_cn":"Agnes AI","logo":"A","country":"SG","website":"https://agnes-ai.com/","api_docs":"https://www.agnes-ai.com/doc/agnes-25-flash","api_base_url":"https://apihub.agnes-ai.com/v1","api_style":"openai","description_cn":"永久免费全模态 API（文本/图像/视频）。","open_weight":false,"source":"official","last_verified":"2026-08-05","brand_color":"#16A34A","logo_file":"assets/logos/agnes.svg","category":"free"},
  {"id":"groq","name":"Groq","name_cn":"Groq","logo":"G","country":"US","website":"https://groq.com/","api_docs":"https://console.groq.com/docs","api_base_url":"https://api.groq.com/openai/v1","api_style":"openai","description_cn":"LPU 极速推理，免费层托管 Llama/Qwen/GPT-OSS。","open_weight":false,"source":"official","last_verified":"2026-08-05","brand_color":"#F55036","logo_file":"assets/logos/groq.svg","category":"gateway"},
  {"id":"openrouter","name":"OpenRouter","name_cn":"OpenRouter","logo":"O","country":"US","website":"https://openrouter.ai/","api_docs":"https://openrouter.ai/docs","api_base_url":"https://openrouter.ai/api/v1","api_style":"openai","description_cn":"一个 API key 路由多家模型，含 20+ 免费模型。","open_weight":false,"source":"official","last_verified":"2026-08-05","brand_color":"#1A1A1A","logo_file":"assets/logos/openrouter.svg","category":"gateway"},